id,literal_id,printed_id,play_agricola_card_id,name_ja,name_en,min_players_number,prerequisite,cost,description,note,is_official_ja,victory_point,special_victory_point,has_arrow,has_bonus_point_icon,has_negative_bonus_icon,has_pan_icon,has_bread_icon,has_farm_planner_icon,has_actions_booster_icon,has_points_provider_icon,has_goods_provider_icon,has_food_provider_icon,has_crop_provider_icon,has_building_resource_provider_icon,has_livestock_provider_icon,has_cut_peat_icon,has_fell_trees_icon,has_slash_and_burn_icon,has_hiring_fare_icon,card_special_color_id,card_type_id,deck_id,revision_id
108037,G037,G037,1718,遅寝,Late Sleeper,4,,,ラウンドのはじめに、遅寝をするかどうかを宣言する。遅寝をする場合、他のプレイヤー全員が家族を置いてからあなたの家族を配置する。その代わりに、あなたはゲストトークンを1つ追加で置ける。（遅寝をしない場合は、通常通り家族を置く。）,,0,0,,0,0,0,0,0,0,0,0,0,0,0,0,0,0,0,0,0,,1,10,1
108038,G038,G038,1719,パン焼き長老見習い,Master Baker's Apprentice,1,,,このカードをプレイしたとき、矢印マーカーを1つ、いずれかの公開されているアクションスペースに置く。このアクションスペースには「そして/または パンを焼く」が追加される。他のプレイヤーがこのスペースを使ってパンを焼くたび、あなたは共通のストックから食料1を得る。このカードをプレイししたとき、すぐに「パンを焼く」アクションを行ってもよい。,,0,0,,0,0,0,0,0,0,0,0,0,0,0,0,0,0,0,0,0,,1,10,1
108039,G039,G039,1720,数学者,Mathematician,4,,,ラウンド6以降、（フェイズ2の終わりに）補充した後、木材の数が等しい木材のアクションスペースがあるなら、それらのうち1スペースから木材1を取れる。レンガのアクションスペースも同様。5人ゲームでは石材のアクションスペースも同様。ただし、この方法で取れる資材は各ラウンドで1つだけ。,,0,0,,0,0,0,0,0,0,0,0,0,0,0,0,0,0,0,0,0,,1,10,1
108040,G040,G040,1721,炭坑夫,Miner,1,,,アクションスペース「日雇い労働者」を使うたび、その帰宅フェイズ（フェイズ４）で、いずれかのアクションスペース「石材1」（ステージ2または4で登場）にある石材マーカーをすべて取れる。,,0,0,,0,0,0,0,0,0,0,0,0,0,0,0,0,0,0,0,0,,1,10,1
108041,G041,G041,1722,たかり屋,Mooch,3,,,このカードをプレイするとき、他のプレイヤー1人を指名する。次の収穫フェイズが終わるまでの間、あなたは自分のものに加えて、指名したプレイヤーの進歩を使って家畜、野菜、小麦、建築資材を食料に換えてもよい。（指名されたプレイヤーは、通常通り自分の進歩を使ってよい。）,,0,0,,0,0,0,0,0,0,0,0,0,0,0,0,0,0,0,0,0,,1,10,1
108042,G042,G042,1723,最古の職業,Oldest Occupation,4,,,ラウンド5以降、アクションスペース「日雇い労働者」を使ったプレイヤーは、あなたに食料2を払って、すぐに「家族を増やす」アクションを行ってもよい。（空き部屋は必要。あなたが「日雇い労働者」を使用した場合、無料で家族を増やせる。）,,0,0,,0,0,0,0,0,0,0,0,0,0,0,0,0,0,0,0,0,,1,10,1
108043,G043,G043,1724,日和見主義者,Opportunist,4,,,各ラウンドのあなたの最後のアクションで、この労働フェイズ中にまだ取られていない種類の建築資材を取ったなら、その資材のうち好きな種類のものを追加で1つ得る。,,0,0,,0,0,0,0,0,0,0,0,0,0,0,0,0,0,0,0,0,,1,10,1
108044,G044,G044,1725,真珠採り,Pearl Seeker,1,,,アクションスペース「漁」を使うたび、追加で石材1を得る。さらに、そのアクションから取った食料（カードから得たものを除く）を使って追加の石材を購入してもよい。石材1につき食料2必要。,,0,0,,0,0,0,0,0,0,0,0,0,0,0,0,0,0,0,0,0,,1,10,1
108045,G045,G045,1726,巡礼者,Pilgrim,1,,,この職業コストを支払う前に食料2を得る。ラウンドのはじめに建築資材を1つも持っていないなら、共通のストックから建築資材を1つ取れる。同様に、食料を1つも持っていない場合、食料を1つ得られる。（いつでも、あなたのストックにある資源を共通のストックに戻してよい。）,,0,0,,0,0,0,0,0,0,0,0,0,0,0,0,0,0,0,0,0,,1,10,1
108046,G046,G046,1727,池の番人,Pond Watchman,4,,,労働フェイズの終わりに、他のプレイヤーが全員アクションを終えた後、あなたは食料1を払って、アクションスペース「漁」にいる自分の家族を、空いている木材の累積スペースに移動させ、そのアクションを行ってもよい。,,0,0,,0,0,0,0,0,0,0,0,0,0,0,0,0,0,0,0,0,,1,10,1
108047,G047,G047,1728,資材集め,Resource Collector,1,,,木材1、レンガ1、葦1、石材1を続く4ラウンドのスペースに好きな順で置く。これらのラウンドのはじめに、その資源を得る。,,0,0,,0,0,0,0,0,0,0,0,0,0,0,0,0,0,0,0,0,,1,10,1
108048,G048,G048,1729,舞台監督,Ringmaster,4,,,アクションスペースで「小劇場」アクションを使用するたび、その後に小さな進歩をプレイするか、小麦1を払って大きい進歩を建設してもよい。（進歩のコストは通常通り支払う。）,,0,0,,0,0,0,0,0,0,0,0,0,0,0,0,0,0,0,0,0,,1,10,1
108049,G049,G049,1730,種職人,Seed Master,1,,,いつでも、食料1を払って自分のストックにある小麦1を野菜1に換えてよい。いつでも、自分のストックにある野菜1を小麦1に換えてよい。,,0,0,,0,0,0,0,0,0,0,0,0,0,0,0,0,0,0,0,0,,1,10,1
108050,G050,G050,1731,歌い手,Singer,1,,,このカードをプレイしたとき、すぐに好きな（同じまたは異なる）建築資材2つを得る。,,0,0,,0,0,0,0,0,0,0,0,0,0,0,0,0,0,0,0,0,,1,10,1
108051,G051,G051,1732,石材運び,Stone Deliveryman,3,,,ラウンド8、10、12、14のスペースにそれぞれ石材1を置く。これらのラウンドのはじめにその石材を得る。,,0,0,,0,0,0,0,0,0,0,0,0,0,0,0,0,0,0,0,0,,1,10,1
108052,G052,G052,1733,石材商人,Stone Trader,4,,,アクションで石材を取るたび、食料1を支払い、印刷されたコストに石材が含まれる進歩をプレイしてもよい。（進歩のコストは通常通り支払う。）,,0,0,,0,0,0,0,0,0,0,0,0,0,0,0,0,0,0,0,0,,1,10,1
108053,G053,G053,1734,石積み,Stonepiler,1,,,柵か厩を建設するたび、そのコストの一部もしくは全部を石材で支払ってもよい。石材1つは木材2つ分とみなす。,,0,0,,0,0,0,0,0,0,0,0,0,0,0,0,0,0,0,0,0,,1,10,1
108054,G054,G054,1329,徴税人,Tax Collector,3,,,他のプレイヤーが建築資材を支払って大きい進歩を建設するたび、あなたはその中から好きな建築資材1つを得る。さらに食料1を共通のストックに払って、残りの建築資材から好きなものを1つ得てもよい。,,0,0,,0,0,0,0,0,0,0,0,0,0,0,0,0,0,0,0,0,,1,10,1
108055,G055,G055,1736,トリュフ掘り,Truffle Digger,4,,,家族のアクションで、累積スペースから木材を取るたび、猪を1/2/3頭飼っていれば、追加で食料1/2/3を得る。,,0,0,,0,0,0,0,0,0,0,0,0,0,0,0,0,0,0,0,0,,1,10,1
108056,G056,G056,1737,代役,Understudy,1,,,あなたの家族1人だけで占有されているアクションスペースに、2人目の家族を置いてもよい。（新生児は家族とみなす。）,,0,0,,0,0,0,0,0,0,0,0,0,0,0,0,0,0,0,0,0,,1,10,1
108057,G057,G057,1738,菜食主義者,Vegetarian,1,,,（いかなる方法でも）食料に換えた小麦や野菜1につき、追加で食料1を得る。あなたは残りのゲーム中、家畜を食料に換えられない。,,0,0,,0,0,0,0,0,0,0,0,0,0,0,0,0,0,0,0,0,,1,10,1
108058,G058,G058,1739,村の農夫,Village Farmer,3,,,このカードをプレイしたとき、残りラウンド数が1/3/6/9ならば、すぐに木材1/2/3/4を得る。ゲーム終了時、畑を最も多く耕しているプレイヤーは全員ボーナス3点を得る。,,0,0,,0,1,0,0,0,0,0,0,0,0,0,0,0,0,0,0,0,,1,10,1
108059,G059,G059,1740,詐欺師,Wheedler,1,,,アクションスペースから食料を得るたび、追加で食料1を得る。進歩や職業の効果で得た食料には適用されない。,,0,0,,0,0,0,0,0,0,0,0,0,0,0,0,0,0,0,0,0,,1,10,1
108060,G060,G060,1741,出稼ぎ工芸家,Wintercrafter,1,,,収穫の畑フェイズと食料供給フェイズの間に、小さい進歩をプレイするか、食料2を払って大きい進歩を建設できる。（進歩のコストは通常通り支払う。）,,0,0,,0,0,0,0,0,0,0,0,0,0,0,0,0,0,0,0,0,,1,10,1
108061,G061,G061,1577,暦,Almanac,,,木材1石材1,このカードをプレイしたとき、すぐにあなたの農場のみ収穫の畑フェイズと繁殖フェイズを行う。（プレイしたカードは自分の前に置かず左どなりの人の手札に入れる）,,0,0,,1,0,0,0,0,0,0,0,0,0,0,0,0,0,0,0,0,,2,10,1
108062,G062,G062,1578,畜産場,Animal Farm,,2種類の家畜,木材1,各ラウンド1回、家畜1頭を共通のストックに戻して、代わりにゲストトークンを得てもよい。このゲストトークンは、このラウンド中に家族と同じように使える。（家畜がゲストになる）,,0,0,,0,0,0,0,0,0,0,0,0,0,0,0,0,0,0,0,0,,2,10,1
108063,G063,G063,1579,パン焼き畑,Baking Field,,職業2 パン焼き進歩1,,種をまくとき、畑にまくようにしてこのカードの上に小麦を植えられる。収穫時、この畑から収穫した小麦をすぐに焼いてパンにしなければならない。（このカードは得点計算で畑に含めない）,,0,0,,0,0,0,0,0,0,0,0,0,0,0,0,0,0,0,0,0,,2,10,1
108064,G064,G064,1580,物々交換所,Bartering Hut,,,,このカードをプレイしたとき、すぐに共通のストックから（同じまたは異なる）家畜を2頭まで購入する。コストは羊1につき建築資材2、猪1につき建築資材3、牛1につき建築資材4。（プレイしたカードは自分の前に置かず左どなりの人の手札に入れる）,,0,0,,1,0,0,0,0,0,0,0,0,0,0,0,0,0,0,0,0,,2,10,1
108065,G065,G065,1742,ハチの巣型暖炉,Beehive Oven,,,石材2,「パンを焼く」アクションを行うとき、ハチの巣型暖炉を使用して小麦最大1を食料4に換えられる。ハチの巣型暖炉を使わずに小麦を1つ以上パンにしたとき、追加で食料1を得る。このカードをプレイしたとき、すぐに「パンを焼く」アクションを行える。,,0,1,,0,0,0,0,0,0,0,0,0,0,0,0,0,0,0,0,0,,2,10,1
108066,G066,G066,1743,誕生石,Birthstone,,,,家族を増やすたび、石材1を払ってボーナス1点を得てもよい。誕生石をプレイしたとき、このラウンド中にすでに新しい家族が増えていた場合は、すぐにこの効果を行ってよい。,,0,0,,0,1,0,0,0,0,0,0,0,0,0,0,0,0,0,0,0,,2,10,1
108067,G067,G067,1744,豊作,Bountiful Harvest,,職業2,,収穫時に2つ以上の資源を収穫し、かつ1頭以上家畜を繁殖させた場合、共通のストックから食料1をこのカードの上に置く。あなたはこの食料をいつでも使える。ゲーム終了時に、このカードの上にある食料1につきボーナス1点を得る。,,0,0,,0,1,0,0,0,0,0,0,0,0,0,0,0,0,0,0,0,,2,10,1
108068,G068,G068,1745,物語,Chronicle,,職業1,木材2/レンガ2,大きい進歩ボードに残っている大きい進歩の上にそれぞれ食料1を置く。これらの進歩が獲得されたとき、あなたはその食料を得る。,,0,0,,0,0,0,0,0,0,0,0,0,0,0,0,0,0,0,0,0,,2,10,1
108069,G069,G069,1746,皆伐,Clear Cutting,,職業1,木材1,畑1以上耕すたび、耕した畑の数だけ共通のストックから木材1を得る。,,0,0,,0,0,0,0,0,0,0,0,0,0,0,0,0,0,0,0,0,,2,10,1
108070,G070,G070,1747,家畜檻,Corral,,職業1,木材3,家の縦横に隣接している空の畑それぞれに同じ種類の家畜を2頭まで収容できる。異なる家畜檻には異なる種類の家畜を飼える。ゲーム終了時に、1頭以上家畜を飼っているこれらの畑1につきボーナス1点を得る。,,0,0,,0,1,0,0,0,0,0,0,0,0,0,0,0,0,0,0,0,,2,10,1
108071,G071,G071,1748,牛の鈴,Cow Bell,,,レンガ1,未使用の農場スペースに牛を2頭まで飼える。ただし最大でも4頭まで。（そのスペースは未使用スペースとみなす。）,,0,0,,0,0,0,0,0,0,0,0,0,0,0,0,0,0,0,0,0,,2,10,1
108072,G072,G072,1749,糞山,Dunghill,,職業2,木材1,収穫の畑フェイズのはじめに2/3種類の家畜を飼っていれば、栽培中の畑（もしくはカード）1/2つに資源を１つ追加してもよい。（ヤギのような動物のカードは数えない。カードに収容している家畜は含めてよい。）,,0,0,,0,0,0,0,0,0,0,0,0,0,0,0,0,0,0,0,0,,2,10,1
108073,G073,G073,1750,移動式暖炉,Errant Oven,,,,このカードをプレイしたとき、すぐに「パンを焼く」アクションを行う。（プレイしたカードは自分の前に置かず左どなりの人の手札に入れる）,,0,0,,1,0,0,0,0,0,0,0,0,0,0,0,0,0,0,0,0,,2,10,1
108074,G074,G074,1751,武者修行,Extra Effort,,,食料1,このカードをプレイしたとき、すぐに大きい進歩を建設する。（進歩のコストは通常通り支払う。）（プレイしたカードは自分の前に置かず左どなりの人の手札に入れる）,,0,0,,1,0,0,0,0,0,0,0,0,0,0,0,0,0,0,0,0,,2,10,1
108075,G075,G075,1752,農家市場,Farmers Market,,,食料2,このカードをプレイしたとき、すぐに野菜1を得る。（プレイしたカードは自分の前に置かず左どなりの人の手札に入れる）,,0,0,,1,0,0,0,0,0,0,0,0,0,0,0,0,0,0,0,0,,2,10,1
108076,G076,G076,1753,園芸用具,Gardening Tools,,,木材2,他のプレイヤーが種をまくたび、あなたは共通のストックに食料1を支払い「種をまく」アクションを行ってもよい。,,0,0,,0,0,0,0,0,0,0,0,0,0,0,0,0,0,0,0,0,,2,10,1
108077,G077,G077,1754,錐,Gimlet,,,木材1レンガ1,木/レンガ/石の部屋の増築コストは、木材/レンガ/石材1少なくなる。毎ラウンド最大2つまで、厩の建設コストが木材1少なくなる。,,0,1,,0,0,0,0,0,0,0,0,0,0,0,0,0,0,0,0,0,,2,10,1
108078,G078,G078,1755,小麦市場,Grain Market,,小麦畑3,,小麦を1つ以上収穫するたび、その後すぐに自分のストックにある小麦1を野菜1に交換できる。,,0,1,,0,0,0,0,0,0,0,0,0,0,0,0,0,0,0,0,0,,2,10,1
108079,G079,G079,1756,金槌,Hammer,,,,このカードをプレイしたとき、すぐに「柵」アクションを行う。柵を1本以上建てているプレイヤー全員に、木材1を払わなければならない。（プレイしたカードは自分の前に置かず左どなりの人の手札に入れる）,,0,0,,1,0,0,0,0,0,0,0,0,0,0,0,0,0,0,0,0,,2,10,1
108080,G080,G080,1757,収穫の宴,Harvest Feast,,職業3,,このカードをプレイしたとき、各プレイヤーはすぐに植えてある資源を好きなだけ自分のストックに移してよい。（これは収穫には数えない。）,,0,1,,0,0,0,0,0,0,0,0,0,0,0,0,0,0,0,0,0,,2,10,1
108081,G081,G081,1758,干草置き場,Hayloft,,,木材1,ゲーム終了時に、厩が3/4つあるならボーナス1/2点を得る。,,0,0,,0,1,0,0,0,0,0,0,0,0,0,0,0,0,0,0,0,,2,10,1
108082,G082,G082,1759,雇われの助っ人,Hired Helpers,,,食料1,毎ラウンド、ゲストトークンを1つ家族と同じように配置してよい。そうした場合、次のラウンドであなたは置ける人物が1人少なくなる。この効果は、2ラウンド続けて使用したり、ラウンド14で使用したりすることはできない。,,0,0,,0,0,0,0,0,0,0,0,0,0,0,0,0,0,0,0,0,,2,10,1
108083,G083,G083,1760,休日の贈り物,Holiday Present,,,木材1/レンガ1,このカードをプレイしたとき、すぐに物乞いカードを1枚捨てるか、好きな家畜1を共通のストックから得る。（プレイしたカードは自分の前に置かず左どなりの人の手札に入れる）,,0,0,,1,0,0,0,0,0,0,0,0,0,0,0,0,0,0,0,0,,2,10,1
108084,G084,G084,1761,馬小屋,Horse Barn,,職業1,,種をまくとき、厩ちょうど1つに縦横に隣接する畑にまくなら、その畑に小麦1または野菜1を追加で置く。厩2つ以上に隣接する畑には、小麦2または野菜2を追加で置く。（厩が柵で囲われているかどうかは問わない。）,,0,0,,0,0,0,0,0,0,0,0,0,0,0,0,0,0,0,0,0,,2,10,1
108085,G085,G085,1762,灌漑用水路,Irrigation Canal,,,木材1石材1,栽培中の畑に縦横に隣接するように畑を耕すとき、その畑から小麦または野菜1を取り、新しく耕した畑にすぐ植えてよい。このとき、新しく耕した畑に置く小麦や野菜は、1つ少なくなる。,,0,1,,0,0,0,0,0,0,0,0,0,0,0,0,0,0,0,0,0,,2,10,1
108086,G086,G086,1763,移動労働者,Itinerant Laborers,,,食料1,このカードをプレイしたとき、すぐに「種をまく」アクションを行う。（プレイしたカードは自分の前に置かず左どなりの人の手札に入れる）,,0,0,,1,0,0,0,0,0,0,0,0,0,0,0,0,0,0,0,0,,2,10,1
108087,G087,G087,1764,魔法の豆,Magic Beans,,,牛1,このカードをプレイしたとき、すぐに野菜2を得る。（プレイしたカードは自分の前に置かず左どなりの人の手札に入れる）,,0,0,,1,0,0,0,0,0,0,0,0,0,0,0,0,0,0,0,0,,2,10,1
108088,G088,G088,1765,ミートパイ,Meat Pie,,職業1,小麦2/家畜1,小麦を1つ以上パンにするたび、追加で小麦1と家畜1を払ってボーナス3点を得てもよい。このカードをプレイしたとき、すぐに「パンを焼く」アクションを行ってもよい。,,0,1,,0,1,0,0,0,0,0,0,0,0,0,0,0,0,0,0,0,,2,10,1
108089,G089,G089,1766,移住労働者,Migrant Workers,,職業1,木材2,アクションスペース「日雇い労働者」を使うたび、食料1を支払って畑1を耕してもよい。,,0,0,,0,0,0,0,0,0,0,0,0,0,0,0,0,0,0,0,0,,2,10,1
108090,G090,G090,1767,放牧場,Paddocks,,,,このカードをプレイしたときすぐに、すでにある牧場の内側に（無料で）柵を4本まで置ける。（プレイしたカードは自分の前に置かず左どなりの人の手札に入れる）,,0,0,,1,0,0,0,0,0,0,0,0,0,0,0,0,0,0,0,0,,2,10,1
108091,G091,G091,1768,毛皮の屋根,Pelt Roof,,職業2,,猪1、牛1、羊2のいずれかを食料に換えるたび、共通のストックから葦1をこのカードの上に置いてもよい。この葦は、増築または改築に使用できる。,,0,0,,0,0,0,0,0,0,0,0,0,0,0,0,0,0,0,0,0,,2,10,1
108092,G092,G092,1769,マツの森,Pine Forest,,,,ラウンドのはじめに、あなたのストックの木材が0個なら、共通のストックから木材1をこのカードの上に置いてもよい。この木材が5つになったら、あなたのストックに移す。（このカードの木材のためだけに、自分のストックにある木材を共通のストックに返すことはできない。）,,0,0,,0,0,0,0,0,0,0,0,0,0,0,0,0,0,0,0,0,,2,10,1
108093,G093,G093,1770,豊穣地,Plentiful Fields,,,,このカードをプレイしたとき、あなたの農場の栽培中の畑1つにつき食料1をすぐに得る。（プレイしたカードは自分の前に置かず左どなりの人の手札に入れる）,,0,0,,1,0,0,0,0,0,0,0,0,0,0,0,0,0,0,0,0,,2,10,1
108094,G094,G094,1771,ろくろ,Potters Wheel,,,木材1,レンガ1を陶工か製陶所で食料に換えるたび、追加で食料1を得る。今後、あなたは製陶所を小さい進歩として出せる。,,0,0,,0,0,0,0,0,0,0,0,0,0,0,0,0,0,0,0,0,,2,10,1
108095,G095,G095,1772,個人間取引,Private Market,,,木材1レンガ1,毎ラウンド1回、あなたは食料2を好きな建築資材1つと交換できる。,,0,1,,0,0,0,0,0,0,0,0,0,0,0,0,0,0,0,0,0,,2,10,1
108096,G096,G096,1773,私立学校,Private School,,,木材3/レンガ3,このカードは、プレイヤー全員が使える追加のアクションスペースである。私立学校を使うプレイヤーは、あなたに食料1を支払い、職業1をプレイする。ただし、追加のコストは支払うこと。（族長、愛人など）,,0,1,,0,0,0,0,0,0,0,0,0,0,0,0,0,0,0,0,0,,2,10,1
108097,G097,G097,1774,滑車,Pulley,,,木材2,アクションスペース「日雇い労働者」を使うたび、その後すぐに1部屋だけ増築してもよい。（増築のための資材は通常通り支払う。）,,0,1,,0,0,0,0,0,0,0,0,0,0,0,0,0,0,0,0,0,,2,10,1
108098,G098,G098,1775,かぼちゃパイ,Pumpkin Pie,,,小麦2/野菜1,小麦を1つ以上パンにするたび、追加で小麦1と野菜1を払ってボーナス3点を得てもよい。このカードをプレイしたとき、すぐに「パンを焼く」アクションを行ってもよい。,,0,1,,0,1,0,0,0,0,0,0,0,0,0,0,0,0,0,0,0,,2,10,1
108099,G099,G099,1312,葦床,Reed Beds,,職業1,木材2,アクションスペース「畑1を耕す」を使うたび、追加で葦1を得る。,,0,1,,0,0,0,0,0,0,0,0,0,0,0,0,0,0,0,0,0,,2,10,1
108100,G100,G100,1776,葦の売却,Reed Sale,,,葦1,このカードをプレイしたとき、すぐに食料3を得る。（プレイしたカードは自分の前に置かず左どなりの人の手札に入れる）,,0,0,,1,0,0,0,0,0,0,0,0,0,0,0,0,0,0,0,0,,2,10,1
108101,G101,G101,1777,改装,Remodeling,,厩1,木材1葦1,このカードをプレイしたとき、すぐに厩1つをストックに戻し、木の家を1部屋増築する。（増築のコストは不要であるが、このカードを出すためのコストは支払うこと。）（プレイしたカードは自分の前に置かず左どなりの人の手札に入れる）,,0,0,,1,0,0,0,0,0,0,0,0,0,0,0,0,0,0,0,0,,2,10,1
108102,G102,G102,1778,ソーセージ練り器,Sausage Grinder,,,石材2,家畜を食料に換えるたび、食料に換えた家畜1につき追加で食料1を得る。,,0,1,,0,0,0,0,0,0,0,0,0,0,0,0,0,0,0,0,0,,2,10,1
108103,G103,G103,1779,大鎌,Scythe,,職業1,木材1石材1,すでに資源が植えられている畑に種をまいてもよい。新しい資源は、すでに植えられているものに重ねて置く。同じ畑に異なる品物を植えることはできない。,,0,1,,0,0,0,0,0,0,0,0,0,0,0,0,0,0,0,0,0,,2,10,1
108104,G104,G104,1780,旬の物,Seasonal Plants,,職業1,,偶数ラウンドに種をまくたび、種をまいた畑のうち1つに、対応する資源を追加で1つ置く。,,0,0,,0,0,0,0,0,0,0,0,0,0,0,0,0,0,0,0,0,,2,10,1
108105,G105,G105,1781,種子散布機,Seed Spreader,,,木材1レンガ1,アクションスペース「畑1を耕す」を使うたび、その後すぐに小麦1か野菜1をまいてもよい。,,0,0,,0,0,0,0,0,0,0,0,0,0,0,0,0,0,0,0,0,,2,10,1
108106,G106,G106,1782,共用の壁,Shared Wall,,職業2,石材1,家を牧場の境界線として扱えるようになる。この方法で作られた牧場の内部に増築することはできない。（今後も、15本まで柵を作れる。）,,0,0,,0,0,0,0,0,0,0,0,0,0,0,0,0,0,0,0,0,,2,10,1
108107,G107,G107,1783,羊市場,Sheep Market,,職業1,木材1,収穫のはじめに、小麦1または野菜1を羊1に交換できる。もしくは、羊1を小麦1または野菜1に交換できる。,,0,0,,0,0,0,0,0,0,0,0,0,0,0,0,0,0,0,0,0,,2,10,1
108108,G108,G108,1784,牧羊犬,Sheepdog,,,,未使用の農場スペースそれぞれに羊を2匹まで収容できる。（このスペースは未使用スペースとみなす。）あなたの家に、羊以外の家畜は飼えなくなる。 牧羊犬には、収穫で食料1を供給しなければならない。（食料が足りない場合は、物乞わなければならない。）,,0,0,,0,0,0,0,0,0,0,0,0,0,0,0,0,0,0,0,0,,2,10,1
108109,G109,G109,1785,羊皮の絨毯,Sheepskin Rug,,,羊1,ゲーム終了時にかまどを持っていれば、ボーナス2点を得る。,,0,0,,0,1,0,0,0,0,0,0,0,0,0,0,0,0,0,0,0,,2,10,1
108110,G110,G110,1786,シャベル,Shovel,,,木材1レンガ1,アクションスペース「日雇い労働者」を使うたび、その後すぐに「種をまく」アクションを行ってもよい。,,0,0,,0,0,0,0,0,0,0,0,0,0,0,0,0,0,0,0,0,,2,10,1
108111,G111,G111,1787,草刈り鎌,Sickle,,,木材1,ゲーム終了時に、少なくとも畑5、小麦8、野菜4を持っているならボーナス3点を得る。（畑に植えてある小麦や野菜も含める。）,,0,0,,0,1,0,0,0,0,0,0,0,0,0,0,0,0,0,0,0,,2,10,1
108112,G112,G112,1788,石のクレーン,Stone Crane,,職業2,木材2石材2,他のプレイヤーが増築または改築をするたび、あなたも（家族を配置せずに）そのアクションを行える。このとき、コストは好きな建築資材1つ分少なくなる。,,0,1,,0,0,0,0,0,0,0,0,0,0,0,0,0,0,0,0,0,,2,10,1
108113,G113,G113,1789,石の調理場,Stone Kitchen,,,石材3,"いつでも、以下の通り品物を食料に換えられる:
野菜1→食料4 羊1→食料2 猪1→食料3 牛1→食料4
「パンを焼く」アクションのたびに換えられる:
小麦1→食料3",,0,2,,0,0,0,1,1,0,0,0,0,0,0,0,0,0,0,0,0,,2,10,1
