id,literal_id,printed_id,play_agricola_card_id,name_ja,name_en,min_players_number,prerequisite,cost,description,note,is_official_ja,victory_point,special_victory_point,has_arrow,has_bonus_point_icon,has_negative_bonus_icon,has_pan_icon,has_bread_icon,has_farm_planner_icon,has_actions_booster_icon,has_points_provider_icon,has_goods_provider_icon,has_food_provider_icon,has_crop_provider_icon,has_building_resource_provider_icon,has_livestock_provider_icon,has_cut_peat_icon,has_fell_trees_icon,has_slash_and_burn_icon,has_hiring_fare_icon,card_special_color_id,card_type_id,deck_id,revision_id
114007,BI07,BI07,4661,ラベンスブルグの紡績工場,Ravensberger Spinning Mill,,羊1,,このカードをプレイしたとき、他のプレイヤー全員は共通のストックから食料2を得てもよい。そうしたプレイヤー1人につき1回、あなたは建築資材1を共通のストックに払ってボーナス1点を得てもよい。支払う資材は全て違う種類でなければならない。,,0,0,,0,1,0,0,0,0,0,0,0,0,0,0,0,0,0,0,0,,2,21,1
114008,BI08,BI08,4625,カスタード,Custard,,調理進歩1,,このカードをプレイしたとき、残りの収穫1回につき食料1を得る。累積スペースから石材を取るたび、そのスペースに石材を1つ残す。,,0,0,,0,0,0,0,0,0,0,0,0,0,0,0,0,0,0,0,0,,2,21,1
114009,BI09,BI09,4680,アルム,Alm,,厩1,羊1,このカードをプレイしたとき、農場にある厩1を取り除いて牛1を得ても良い。このカードに牛を何頭でも収容できる。（このカードは得点計算で牧場に含めない。）,,0,1,,0,0,0,0,0,0,0,0,0,0,0,0,0,0,0,0,0,,2,21,1
114010,BI10,BI10,4660,北緯52度の標石,The 52nd Latitude,,,木材1石材1,共通のストックから石材1を取り、未使用の農場スペースに置く。（そのスペースは使用済みになる。）得点計算時に、この石材に縦横に隣接している、空いている畑1につきボーナス1点を得る。,,0,0,,0,1,0,0,0,0,0,0,0,0,0,0,0,0,0,0,0,,2,21,1
114011,BI11,BI11,4627,屠殺教会,Schlachter Church,,家畜2種,木材1レンガ1石材1,他のプレイヤーが:鍋:の進歩で家畜を食料にするたび、その家畜をこのカードの上に置く。いつでもこのカード上の全ての家畜を1頭につき食料1に変換してもよい。その後、このカードは全ての効果を失う。ただし、進歩としては数える。,,0,1,,0,0,0,0,0,0,0,0,0,0,0,0,0,0,0,0,0,,2,21,1
114012,BI12,BI12,4621,連絡通路,Skybridge,,石の家,,縦横に隣接している部屋と部屋の間に、あなたのストックから石材1を置く。石材は2つの部屋の間に1つずつしか置けない。収穫の食料供給フェイズのたびに、この石材1につき小麦1を得る。得点計算時に、この石材1につきボーナス1点を得る。,,0,0,,0,1,0,0,0,0,0,0,0,0,0,0,0,0,0,0,0,,2,21,1
114013,BI13,BI13,4624,木のボタン,Wooden Buttons,,空き部屋2,木材1,空き部屋1につきゲストトークンを1つ取る。ゲストは家族のように扱い、ラウンド終了時に返す。このラウンドは家族を増やすための部屋はなくなる。（プレイしたカードは自分の前に置かず左どなりの人の手札に入れる）,,0,0,,1,0,0,0,0,0,0,0,0,0,0,0,0,0,0,0,0,,2,21,1
114014,BI14,BI14,4611,リネン織工,Linen Weaver,3,,,ラウンドのはじめに、この職業を左どなりのプレイヤーにわたす。現在これを持っているプレイヤーのみが、プレイした職業に数える。全ての進歩のコストは木材1軽減される。これを元の所有者が持っているときは、さらにレンガ1、石材1、葦1だけ軽減される。,,0,0,,1,0,0,0,0,0,0,0,0,0,0,0,0,0,0,0,0,,1,21,1
114015,BI15,BI15,4615,ヴァンパイア,Vampire,3,,,このカードは、右どなりのプレイヤーが前の手番で累積スペースを使用したときのみ出せる。あなたはすぐに同じアクションを行い、同じ数分だけ共通のストックから得る。,,0,0,,0,0,0,0,0,0,0,0,0,0,0,0,0,0,0,0,0,,1,21,1
114016,BI16,BI16,4663,研究所の創設者,Institute Founder,4,,,このカードをプレイしたとき、すぐに食料1を払って小麦1を得てもよい。収穫の食料供給フェイズで、4人目と5人目の家族の食料供給は食料1だけで済む。,,0,0,,0,0,0,0,0,0,0,0,0,0,0,0,0,0,0,0,0,,1,21,1
114017,BI17,BI17,4666,白いブラジル人,White Brazilian,3,,,このカードは、農場の上段5スペースが未使用のときにしかプレイできない。上段の左右の隅に厩1と猪1を置く。猪を指で弾いて厩のスペース内で止められたらその猪を得る（一部がはみ出ても可）。3回まで試せる。,,0,0,,0,0,0,0,0,0,0,0,0,0,0,0,0,0,0,0,0,,1,21,1
114018,BI18,BI18,2513,りんごの人,Apple Man,1,,,帰宅フェイズごとに1回、あなたのストックから野菜1を払って、「畑1を耕す」「柵を建てる」「厩を建てる」アクションのいずれかを、家族を配置せず行ってよい。,,0,0,,0,0,0,0,0,0,0,0,0,0,0,0,0,0,0,0,0,,1,21,1
114019,BI19,BI19,4662,奉仕女,Deaconess,1,,,家族が2人だけならば、1/2/3/4/5/6回目の収穫の食料供給フェイズで食料1/2/3/4/5/6得る。,,0,0,,0,0,0,0,0,0,0,0,0,0,0,0,0,0,0,0,0,,1,21,1
114020,BI20,BI20,4665,生存主義者,Survivalist,1,,,（あなたの家族は何でも食べられる。）収穫の食料供給フェイズで、生存主義者は建築資材1を食料2に変換できる（資材1種ごと最大1まで）。これを行った収穫のたびに、換えた食料のうち1つを「漁」のスペースに置く。,,0,0,,0,0,0,0,0,0,0,0,0,0,0,0,0,0,0,0,0,,1,21,1
114021,BI21,BI21,4608,アドバイザー,Advisor,1,,,次に家族でアクションスペース「漁」を使用したとき、ボーナス2点を得る。それ以降、家族で「漁」のアクションスペースを使用するたび、ボーナス1点を得る。,,0,0,,0,1,0,0,0,0,0,0,0,0,0,0,0,0,0,0,0,,1,21,1
114022,BI22,BI22,4612,反骨の歌手,Protest Singer,1,,,農場の未使用スペース1につき家畜を1頭飼える。（このスペースは未使用のままとする。）これらの家畜は収穫の繁殖フェイズに関わらない。,,0,0,,0,0,0,0,0,0,0,0,0,0,0,0,0,0,0,0,0,,1,21,1
114023,BI23,BI23,4613,社会システム理論家,Systems Theorist,1,,,少なくとも1軒の厩を建てるたびに、食料1を得る。得点計算時に、互いに隣接している厩2/3/4でボーナス1/2/3点を得る。,,0,0,,0,1,0,0,0,0,0,0,0,0,0,0,0,0,0,0,0,,1,21,1
114024,BI24,BI24,4015,協同組合員,Member of a Co-operative,3,,,他のプレイヤーが「家族を増やす」アクションを行うたび、このカードの上に共通のストックから食料1を置く。3/4/5人ゲームで一度だけ、このカードの上から食料3/4/5を支払ってもよい。そうすると、次の「家族を増やす」アクションを「家族を増やす 部屋がなくてもよい」として行う。,,0,0,,0,0,0,0,0,0,0,0,0,0,0,0,0,0,0,0,0,,1,21,1
115001,FR001,FR001,3845,耕作放棄地,Abandoned Willow,,空いている畑1,,すぐに空いている畑1を取り除き、木材4を得る。（そこは未使用の農場スペースに戻る。）（プレイしたカードは自分の前に置かず左どなりの人の手札に入れる）,,0,0,,1,0,0,0,0,0,0,0,0,0,0,0,0,0,0,0,0,,2,22,1
115002,FR002,FR002,4005,アブサン,Absinthe,,職業3,,以降の5ラウンドのスペースに食料1ずつ置く。これらのラウンドの労働フェイズのはじめに、好きなアクションスペースにその食料を置く。（そのスペースを次に使用したプレイヤーがその食料を得る。）,,0,1,,0,0,0,0,0,0,0,0,0,0,0,0,0,0,0,0,0,,2,22,1
115003,FR003,FR003,3774,遊園地,Amusement Park,,牧場1,,牧場1/2/3/4があれば、以降の2/3/4/5ラウンドのスペースに食料1ずつ置く。これらのラウンドのはじめにその食料を得る。,,0,1,,0,0,0,0,0,0,0,0,0,0,0,0,0,0,0,0,0,,2,22,1
115004,FR004,FR004,3224,りんご園,Apple Garden,,,,ゲーム終了時に、小麦か野菜を持っていなければボーナス2点を得る。（りんごがその品物の代わりになる。）（持っていない品物のマイナス点はそのまま得る。）,,0,0,,0,1,0,0,0,0,0,0,0,0,0,0,0,0,0,0,0,,2,22,1
115005,FR005,FR005,2582,芸術家の庭,Artists Garden,,職業3,,帰宅フェイズのたびに、畑1から収穫してもよい。,,0,1,,0,0,0,0,0,0,0,0,0,0,0,0,0,0,0,0,0,,2,22,1
115006,FR006,FR006,2851,アナグマ,Badger,,,レンガ1,好きなアクションスペース1か所にマーカーを置く。ラウンドのはじめに、そのマーカーを、そこに縦横に隣接する公開済みのアクションスペース1つに移動させる。そのスペースを使用したプレイヤーは、追加で食料1を得る。,,0,0,,0,0,0,0,0,0,0,0,0,0,0,0,0,0,0,0,0,,2,22,1
115007,FR007,FR007,2659,バゲット,Baguette,,,,収穫の間、:パン:の進歩を持っているなら、食料供給フェイズのはじめに木材1を払ってパンを焼いてもよい。,,0,0,,0,0,0,0,0,0,0,0,0,0,0,0,0,0,0,0,0,,2,22,1
115008,FR008,FR008,3225,理髪店,Barber Shop,,,木材3葦1,このカードをプレイしたとき、残りの収穫1回につきボーナス1点を得る。,,0,0,,0,1,0,0,0,0,0,0,0,0,0,0,0,0,0,0,0,,2,22,1
115009,FR009,FR009,2569,浴室,Bathroom,,耕した畑1,,小麦か野菜を食料に換えるたび、その作物をこのカードの上に置いてもよい。種をまくたび、植えた畑ごとにこのカードの上から同種の品物を1つ追加で乗せてもよい。（このカードの上にある品物は得点計算で数えない。）,,0,0,,0,0,0,0,0,0,0,0,0,0,0,0,0,0,0,0,0,,2,22,1
115010,FR010,FR010,2863,草上の昼食,Breakfast Outdoors,,,小麦2/野菜1,食料供給フェイズのたびに食料1を得る。,,0,1,,0,0,0,0,0,0,0,0,0,0,0,0,0,0,0,0,0,,2,22,1
115011,FR011,FR011,4271,レンガ工場,Brickyard,,職業2,,ラウンドのはじめに、自分のストックにレンガが1つもなければこのカードにレンガ1を置く。このカードにレンガが4つ以上あれば、いつでもそのレンガを全て自分のストックに移してよい。,,0,0,,0,0,0,0,0,0,0,0,0,0,0,0,0,0,0,0,0,,2,22,1
115012,FR012,FR012,2399,カマンベール,Camembert,,職業2,,アクションスペース3か所に共通のストックから食料1ずつ置く。（占有されているか否かは問わない。）次にそのアクションスペースを使ったプレイヤーがその食料を得る。,,0,1,,0,0,0,0,0,0,0,0,0,0,0,0,0,0,0,0,0,,2,22,1
115013,FR013,FR013,2397,カメレオン,Chameleon,,,羊1,このカードをプレイしたとき、すぐに猪1を得る。羊のいる牧場それぞれに猪を1頭まで一緒に飼える。（牧場は通常通りの数だけの家畜を収容できる。）,,0,0,,0,0,0,0,0,0,0,0,0,0,0,0,0,0,0,0,0,,2,22,1
115014,FR014,FR014,2576,ショコラーデ,Chocolade,,大きい進歩1,,このカードの上に共通のストックから食料4を置く。この食料は職業をプレイするためにだけ使える。,,0,0,,0,0,0,0,0,0,0,0,0,0,0,0,0,0,0,0,0,,2,22,1
115015,FR015,FR015,3786,コーヒーブレイク,Coffee Break,,,レンガ1,以降の5ラウンドのスペースに食料1ずつ置く。これらのラウンドのはじめにその食料を得る。最後の食料を得る前に職業をプレイしたら、将来のラウンドに置いたこのカードによる食料をすぐに取り除く。,,0,1,,0,0,0,0,0,0,0,0,0,0,0,0,0,0,0,0,0,,2,22,1
115016,FR016,FR016,4011,積みわら,Cornrick,,畑1,食料1,ラウンド7と9のスペースに小麦1ずつ置く。これらのラウンドのはじめにその小麦を得る。,,0,0,,0,0,0,0,0,0,0,0,0,0,0,0,0,0,0,0,0,,2,22,1
115017,FR017,FR017,2436,日記,Diary,,職業2,,職業をプレイするたびに、木材1を得る。,,0,0,,0,0,0,0,0,0,0,0,0,0,0,0,0,0,0,0,0,,2,22,1
115018,FR018,FR018,3106,包囲壁,Encircling Wall,,,石材4,このカードをプレイしたとき、すぐに農場スペース1か所を柵で囲んで牧場にする。（柵のための木材は必要ない。）,,0,2,,0,0,0,0,0,0,0,0,0,0,0,0,0,0,0,0,0,,2,22,1
115019,FR019,FR019,2939,晩課,Evening Prayer,,職業なし,,農場に耕した畑1/2があれば、すぐに食料1/2を払って職業を1/2枚プレイしてよい。,,0,0,,0,0,0,0,0,0,0,0,0,0,0,0,0,0,0,0,0,,2,22,1
115020,FR020,FR020,3797,五輪,Five Rings,,,木材1/石材1,このカードのコストに木材/石材を選んだなら、進歩をプレイするたびにコストを木材1/石材1だけ軽減する。（共通のストックから木材1/石材1を置いて示す。）,,0,0,,0,0,0,0,0,0,0,0,0,0,0,0,0,0,0,0,0,,2,22,1
115021,FR021,FR021,3366,平らな丘,Flat Hill,,栽培中の畑4,,このカードをプレイしたとき、すぐに木の家を無料でレンガの家に改築する。,,0,0,,0,0,0,0,0,0,0,0,0,0,0,0,0,0,0,0,0,,2,22,1
115022,FR022,FR022,3904,かつら,Full Bottomed Wig,,羊3,,改築で葦が不要になる。,,0,1,,0,0,0,0,0,0,0,0,0,0,0,0,0,0,0,0,0,,2,22,1
115023,FR023,FR023,3085,杯,Goblet,,,木材1,あなたにとって（大きい進歩の）井戸は小さい進歩になる。井戸を建設したら、以降の5ラウンドのスペースに食料1ではなく食料2ずつ置く。（すでに井戸があるなら効果はない）,,0,0,,0,0,0,0,0,0,0,0,0,0,0,0,0,0,0,0,0,,2,22,1
115024,FR024,FR024,4384,金のバラ,Golden Rose,,栽培中の畑1,,職業か小さい進歩をプレイするために食料を払うたび、食料2つ分まで軽減してもよい。,,0,1,,0,0,0,0,0,0,0,0,0,0,0,0,0,0,0,0,0,,2,22,1
115025,FR025,FR025,2589,製粉オーブン,Grain Mill Oven,,,レンガ1石材1,製粉オーブンでパンを焼くことはできない。あなたにとってレンガ暖炉と石の暖炉は小さい進歩となる。暖炉のコストを支払う代わりにこのカードを捨ててもよい。このカードをプレイしたときに、追加で「パンを焼く」アクションを行ってよい。,,0,0,,0,0,0,0,0,0,0,0,0,0,0,0,0,0,0,0,0,,2,22,1
115026,FR026,FR026,2597,洞窟,Grotto,,職業2,,このカードの上にレンガ3と石材2を置く。ラウンドの終わりに、食料2を払ってこれらの資源を1つ得てもよい。このカードが空になり次第、このカードは家族を1人収容できる部屋になる。,,0,0,,0,0,0,0,0,0,0,0,0,0,0,0,0,0,0,0,0,,2,22,1
115027,FR027,FR027,2854,つるはし鋤,Ground Pickaxe Plow,,,木材1,ゲーム中1回、アクションスペース「畑1を耕す」か「畑1を耕す そして/または 種をまく」で、（使用した方のスペースに）縦横に隣接するアクションスペース（公開されているか否かは問わない）を1/2か所選んで、自分のストックから木材1ずつ置けば、追加で畑1/2を耕せる。,,0,0,,0,0,0,0,0,0,0,0,0,0,0,0,0,0,0,0,0,,2,22,1
115028,FR028,FR028,4245,ハンモック,Hammock,,4部屋,木材2羊1,部屋のうち1か所に家族を追加で1人収容できる。,,0,1,,0,0,0,0,0,0,0,0,0,0,0,0,0,0,0,0,0,,2,22,1
115029,FR029,FR029,2318,集草機,Hay Rake,,,木材1,労働フェイズで、3人目の家族はアクションスペース「畑1を耕す」を占有済みだったとしても使用できる。,,0,0,,0,0,0,0,0,0,0,0,0,0,0,0,0,0,0,0,0,,2,22,1
115030,FR030,FR030,2427,干し草山,Haystack,,家畜6,木材1,以降のラウンドスペースに食料3ずつ置く。これらのラウンドのはじめにその食料を得る。,,0,0,,0,0,0,0,0,0,0,0,0,0,0,0,0,0,0,0,0,,2,22,1
115031,FR031,FR031,3796,熱波,Heatwave,,レンガか石の家,石材1,すぐに無料でかまどを建設する。もしくは、かまどを調理場に改良する。（プレイしたカードは自分の前に置かず左どなりの人の手札に入れる）,,0,0,,1,0,0,0,0,0,0,0,0,0,0,0,0,0,0,0,0,,2,22,1
115032,FR032,FR032,3213,宿題,Homework,,,葦2食料2,このカードをプレイしたとき、すぐに職業を2枚までプレイしてよい。（ただし追加のコストは支払うこと。）,,0,1,,0,0,0,0,0,0,0,0,0,0,0,0,0,0,0,0,0,,2,22,1
115033,FR033,FR033,2481,子ども部屋,Kids Corner,,,葦1,家に追加で家畜1を飼える。種類が違っていてもよい。,,0,1,,0,0,0,0,0,0,0,0,0,0,0,0,0,0,0,0,0,,2,22,1
115034,FR034,FR034,2794,調理台,Kitchen Table,,,,あなたにとって「パンを焼く」アクションは全て「パンを焼く または 自分のストックから食料1をこのカードに置く」になる。いつでもこのカードの上の食料1を自分のストックに戻して、「パンを焼く」アクションを行ってよい。,,0,0,,0,0,0,0,1,0,0,0,0,0,0,0,0,0,0,0,0,,2,22,1
115035,FR035,FR035,2365,灯台,Lighthouse,,石の家がちょうど2部屋,石材2木材1,灯台は家族1人を収容できる。,,0,2,,0,0,0,0,0,0,0,0,0,0,0,0,0,0,0,0,0,,2,22,1
115036,FR036,FR036,2496,行進曲,March,,,,このカードをプレイしたとき、異なる種類の家畜を2頭を共通のストックに返して畑を2つ耕してもよい。,,0,0,,0,0,0,0,0,0,0,0,0,0,0,0,0,0,0,0,0,,2,22,1
115037,FR037,FR037,3530,ネックレス,Necklace,,職業1,石材1,労働フェイズの終わりに、家族少なくとも2人を縦横に隣接するアクションスペースに置いていれば食料1を得る。,,0,0,,0,0,0,0,0,0,0,0,0,0,0,0,0,0,0,0,0,,2,22,1
115038,FR038,FR038,3861,果樹園,Orchard,,栽培中の畑1,,栽培中の畑の数まで、以降のラウンドに食料1ずつ置く。これらのラウンドのはじめにその食料を得る。,,0,1,,0,0,0,0,0,0,0,0,0,0,0,0,0,0,0,0,0,,2,22,1
115039,FR039,FR039,3785,パル・フォルス式狩猟,Par Force Hunting,,,木材2,現在のラウンドに4と7を足し、対応するラウンドスペースに猪1ずつ置く。これらのラウンドのはじめに食料1を払ってその猪を得られる。,,0,1,,0,0,0,0,0,0,0,0,0,0,0,0,0,0,0,0,0,,2,22,1
115040,FR040,FR040,3685,公園墓地,Park Cemetery,,,,アクションスペース「畑1を耕す」に共通のストックから石材3を置く。このスペースを使用したプレイヤーはそこから石材1を得る。そのスペースに石材がなくなったら、このカードを捨てて畑を1つ耕してよい。,,0,0,,0,0,0,0,0,0,0,0,0,0,0,0,0,0,0,0,0,,2,22,1
115041,FR041,FR041,3863,農民のブティック,Peasant’s Boutique,,かご製作所を返す,,収穫のたびに葦最大1を食料4にできる。ゲーム終了時に葦1/3/4あればそれぞれボーナス1/2/3点を得る。あなたはかご製作所による追加のボーナス点を得られない。,,0,3,,0,1,0,0,0,0,0,0,0,0,0,0,0,0,0,0,0,,2,22,1
115042,FR042,FR042,2678,岩のピラミッド,Rock Pyramid,,,,石の家を建設するたびに畑を1つ耕すことができる。その部屋の建設のために石材1つ以上払っていたら代わりに畑2つまで耕すことができる。,,0,0,,0,0,0,0,0,0,0,0,0,0,0,0,0,0,0,0,0,,2,22,1
115043,FR043,FR043,3939,ソファー,Sofa,,,葦1,ゲーム終了時に、部屋が2/3部屋しかなければボーナス4/2点を得る。,,0,3,,0,1,0,0,0,0,0,0,0,0,0,0,0,0,0,0,0,,2,22,1
115044,FR044,FR044,3479,星付きの食事,Star Classification Meal,,石の家,,これ以降のラウンドのスペースに食料1ずつ置く。これらのラウンドのはじめにその食料を得る。,,0,1,,0,0,0,0,0,0,0,0,0,0,0,0,0,0,0,0,0,,2,22,1
115045,FR045,FR045,3911,石の家再建,Stone House Reconstruction,,,石材1,レンガの家から石の家への改築は、「改築」アクションを使うことなくいつでもできる。（コストは払うこと。）,,0,1,,0,0,0,0,0,0,0,0,0,0,0,0,0,0,0,0,0,,2,22,1
115046,FR046,FR046,2346,わらぶき小屋,Straw-Thatched Hut,,畑2,,レンガの家を増築するたびに、レンガ5と葦2の代わりに、レンガ2と小麦1と食料1を支払ってもよい。,,0,0,,0,0,0,0,0,0,0,0,0,0,0,0,0,0,0,0,0,,2,22,1
115047,FR047,FR047,2347,日曜学校,Sunday School,,,食料2,次のラウンドにマーカーを置く。そのラウンドの間、あなたの配置する家族が1人減る。そのラウンドの終わりにマーカーを取り除き、無料で職業を2枚プレイする。＊プレイしたカードは自分の前に置かず左どなりの人の手札に入れる）,,0,0,,1,0,0,0,0,0,0,0,0,0,0,0,0,0,0,0,0,,2,22,1
115048,FR048,FR048,2763,水上アトリエ,Swimming Studio,,,葦1,アクションスペース「漁」を使用するたびに、木材最大1を食料3に換えてもよい。,,0,1,,0,0,0,0,0,0,0,0,0,0,0,0,0,0,0,0,0,,2,22,1
115049,FR049,FR049,2845,ル・アーブル港,The Port Le Havre,,暖炉1,,「パンを焼く」アクションを使用するたびに、レンガ1/2を石材1/2に換えられる。,,0,1,,0,0,0,0,0,0,0,0,0,0,0,0,0,0,0,0,0,,2,22,1
115050,FR050,FR050,2394,脱穀鋤,Threshing Machine Plow,,,木材1,ゲーム中1回、アクションスペース「畑1を耕す」を使用するたび、畑1を耕す代わりに農場の中央3スペース全てに畑を耕してもよい。（中央の3スペースとは、それぞれ8つの他の未使用スペースに囲まれたスペースのことである。）,,0,0,,0,0,0,0,0,0,0,0,0,0,0,0,0,0,0,0,0,,2,22,1
115051,FR051,FR051,2822,予定表,Timetable,,大きい進歩1,,このカードの上に各建築資材を1つ乗せる。これらの建築資材は、小さい進歩をプレイするために使用できる。,,0,0,,0,0,0,0,0,0,0,0,0,0,0,0,0,0,0,0,0,,2,22,1
115052,FR052,FR052,3081,市民の木,Trees for the Citizens,,職業1,木材3,家具製作所か製材所を持っていれば、このカードのコストはなくなる。ゲーム終了時に、印刷されたコストに木材が含まれる進歩2つにつきボーナス1点を得る。,,0,1,,0,1,0,0,0,0,0,0,0,0,0,0,0,0,0,0,0,,2,22,1
115053,FR053,FR053,2464,湖畔旅行,Trip to the Lake,,職業2,葦1,アクションスペース「漁」を使用するたびに、食料1と木材1を追加で得る。,,0,0,,0,0,0,0,0,0,0,0,0,0,0,0,0,0,0,0,0,,2,22,1
115054,FR054,FR054,3302,チュイルリー庭園,Tuileries Garden,,職業4,木材1石材3,アクションスペース「畑1を耕す」を使用するたびに、その後すぐに小麦1または野菜1を共通のストックから得て、それをまいてもよい。,,0,1,,0,0,0,0,0,0,0,0,0,0,0,0,0,0,0,0,0,,2,22,1
115055,FR055,FR055,3378,野菜の収穫,Vegetable Harvest,,,,暖炉を持っていれば、いつでも野菜を食料に換えられる。野菜1につき食料4。,,0,0,,0,0,0,0,0,0,0,0,0,0,0,0,0,0,0,0,0,,2,22,1
115056,FR056,FR056,2610,じょうろ,Watering Can,,,,すぐに、栽培中の小麦畑それぞれに、共通のストックから小麦1を追加する。栽培中の野菜畑にはそれぞれ野菜1を追加する。（プレイしたカードは自分の前に置かず左どなりの人の手札に入れる）,,0,0,,1,0,0,0,0,0,0,0,0,0,0,0,0,0,0,0,0,,2,22,1
115057,FR057,FR057,2960,ジビエ,Wild Game,,,猪1,すぐに食料5を得る。（プレイしたカードは自分の前に置かず左どなりの人の手札に入れる）,,0,0,,1,0,0,0,0,0,0,0,0,0,0,0,0,0,0,0,0,,2,22,1
115058,FR058,FR058,2391,冬の枯れ木,Winter Deadwood,,,,このカードをプレイしたとき、木材1を払ってボーナス1点を得るか、木材1を得て左どなりのプレイヤーの手札にこのカードを入れるか選ぶ。,,0,0,,0,1,0,0,0,0,0,0,0,0,0,0,0,0,0,0,0,,2,22,1
115059,FR059,FR059,2815,魔女の踊り場,Witches’ Dance Ground,,職業3,,このカードを出すとき農場の脇か上に置く。脇に置いた場合は２つの新しい未使用の農場（通常通り得点計算に含める）となり、ボーナス1点を得る。上に乗せる場合は縦横に隣接する2か所の未使用スペースの上に被せて、以後は農場とみなさなくする。,,0,0,,0,1,0,0,0,0,0,0,0,0,0,0,0,0,0,0,0,,2,22,1
115060,FR060,FR060,2972,のこぎり,Wood Saw,,,木材1,ほかの全てのプレイヤーがあなたより多く家族を持っているなら、いつでもコストを払って増築できる。,,0,0,,0,0,0,0,0,0,0,0,0,0,0,0,0,0,0,0,0,,2,22,1
115061,FR061,FR061,2311,耕地整理,Agrarian,3,,,ラウンドのはじめに、あなたのストックから食料1をアクションスペース「畑1を耕す」に置いてもよい。そのスペースを使用したプレイヤーは追加でその食料を得る。ラウンドの終わりに、そのアクションスペースが使用されていないなら食料があなたに戻る。そして、畑を1つ耕してよい。,,0,0,,0,0,0,0,0,0,0,0,0,0,0,0,0,0,0,0,0,,1,22,1
115062,FR062,FR062,2308,動物福祉士,Animal Welfarist,4,,,アクションスペースの「厩を建てる」アクションと、アクションスペースの「柵を建てる」アクションを両方使用した労働フェイズの終わりに、家畜それぞれを1頭得る。,,0,0,,0,0,0,0,0,0,0,0,0,0,0,0,0,0,0,0,0,,1,22,1
115063,FR063,FR063,4019,美術監督,Art Director,4,,,「小劇場」アクションを使用するたびに、追加で食料1と好きな建築資材1を得る。,,0,0,,0,0,0,0,0,0,0,0,0,0,0,0,0,0,0,0,0,,1,22,1
