id,literal_id,printed_id,play_agricola_card_id,name_ja,name_en,min_players_number,prerequisite,cost,description,note,is_official_ja,victory_point,special_victory_point,has_arrow,has_bonus_point_icon,has_negative_bonus_icon,has_pan_icon,has_bread_icon,has_farm_planner_icon,has_actions_booster_icon,has_points_provider_icon,has_goods_provider_icon,has_food_provider_icon,has_crop_provider_icon,has_building_resource_provider_icon,has_livestock_provider_icon,has_cut_peat_icon,has_fell_trees_icon,has_slash_and_burn_icon,has_hiring_fare_icon,card_special_color_id,card_type_id,deck_id,revision_id
203024,C024,C024,6786,小麦畑のベッド,Bed in the Grain Field,,小麦畑1,,次の収穫の開始時、新生児用の場所があるなら、「家族を増やす」アクションを得る。,,0,0,,0,0,0,0,0,0,1,0,0,0,0,0,0,0,0,0,0,,2,25,2
203025,C025,C025*,4166,蒸気機械,Steam Machine,,,木材2,労働フェイズで、あなたが使った最後のアクションスペースが累積スペースなら、その直後に「パンを焼く」アクションを得る。,,0,1,,0,0,0,0,0,0,1,0,0,0,0,0,0,0,0,0,0,,2,25,2
203026,C026,C026*,9019,パン焼き棒,Flail,,,木材1,このカードを出したとき、すぐに食料2を得る。アクションスペース「農地」または「耕作」を使用するたび、追加で「パンを焼く」アクションを得る。,,0,0,,0,0,0,0,0,0,1,0,0,0,0,0,0,0,0,0,0,,2,25,2
203027,C027,C027*,7387,建築設計図,Blueprint,,,食料1,あなたは大きい進歩の「家具製作所」、「製陶所」、「カゴ製作所」を「小さい進歩」アクションで獲得できる。それらの建設コストは石材1少なくなる。,,0,0,,0,0,0,0,0,0,1,0,0,0,0,0,0,0,0,0,0,,2,25,2
203028,C028,C028,9372,教師の机,Teacher's Desk,,,木材1,アクションスペース「大きい進歩」または「家の建て直し」を使うたび、食料1のコストで職業1を出すことができる。,,1,0,,0,0,0,0,0,0,1,0,0,0,0,0,0,0,0,0,0,,2,25,2
203029,C029,C029,9373,ビールテーブル,Beer Table,,ストックに小麦なし,木材2,各収穫の畑フェイズの終了時、ストックから小麦1を支払うことでボーナス2点を得ることができる。そうした場合、他のプレイヤーは全員、食料1を得る。,,0,0,,0,1,0,0,0,0,0,1,0,0,0,0,0,0,0,0,0,,2,25,2
203030,C030,C030*,1519,木骨の小屋,Half-Timbered House,,,木材1レンガ1葦1石材2,得点計算時に、石の部屋1部屋につきボーナス1点を得る。石の家によってボーナス点を得るカードは1枚しか適用できない。,,0,0,,0,1,0,0,0,0,0,1,0,0,0,0,0,0,0,0,0,,2,25,2
203031,C031,C031,9374,書斎,Writing Chamber,,,木材2,得点計算時に、マイナス点の合計と等しい数のボーナス点を得る。（ただし最大7点まで）。,,1,0,,0,1,0,0,0,0,0,1,0,0,0,0,0,0,0,0,0,,2,25,2
203032,C032,C032,9375,ガードローブ,Abort Oriel,,下記参照,レンガ2,いずれかのプレイヤー（あなたを含む）が自分の前に出しているカードが5枚以上のとき、このカードを出すことができない。,,1,3,,0,1,0,0,0,0,0,1,0,0,0,0,0,0,0,0,0,,2,25,2
203033,C033,C033,9376,緑化計画,Greening Plan,,,食料3,得点計算時に、空の畑が2/4/5/6以上あれば、ボーナス1/2/3/5点を得る。,,0,0,,0,1,0,0,0,0,0,1,0,0,0,0,0,0,0,0,0,,2,25,2
203034,C034,C034,9377,エレファントグラス焼却炉,Elephantgrass Plant,,,レンガ2石材1,収穫の後すぐに、このカードを使ってちょうど葦1をボーナス1点に交換できる。,,0,0,,0,1,0,0,0,0,0,1,0,0,0,0,0,0,0,0,0,,2,25,2
203035,C035,C035*,7934,ランタンの家,Lantern House,,職業なし,木材1,得点計算時に、手札1枚につきマイナス1点を得る。未プレイのカードを手札から破棄できない。すでに手札から破棄しているなら、このカードは出せない。,,0,7,,0,0,0,1,0,0,0,1,0,0,0,0,0,0,0,0,0,,2,25,2
203036,C036,C036,9378,レンガ置き場,Clay Deposit,,職業1,食料2,レンガの累積スペースを使用後すぐに、レンガ1をボーナス1点に交換できる。そうした場合、そのレンガはその累積スペースに置く。,,1,0,,0,1,0,0,0,0,0,1,0,0,0,0,0,0,0,0,0,,2,25,2
203037,C037,C037*,7886,人工の丘,Dwelling Mound,,ラウンド3以前に出す,食料1,あなたは農場に置く新たな畑タイル1枚につき、食料1を支払わなければならない。,,0,3,,0,0,0,0,0,0,0,1,0,0,0,0,0,0,0,0,0,,2,25,2
203038,C038,C038,9379,キリスト教,Christianity,,ちょうど羊1,,このカードを出したとき、他のプレイヤーは全員食料1ずつ得る。,,1,2,,0,0,0,0,0,0,0,1,0,0,0,0,0,0,0,0,0,,2,25,2
203039,C039,C039,9380,アトリエボート,Studio Boat,,職業1,木材1,累積スペース「小劇場」を使うたび、ボーナス1点を得る。プレイ人数が1～3人のゲームでは、このカードは「小劇場」（「漁」と同じ効果）と見なす。,,0,0,,0,1,0,0,0,0,0,1,0,0,0,0,0,0,0,0,0,,2,25,2
203040,C040,C040,9381,ズタ袋,Canvas Sack,,職業を出していない,小麦1/葦1,このカードのコストを小麦/葦で払っているとき、すぐに野菜1/木材4を得る。,,1,1,,0,0,0,0,0,0,0,0,1,0,0,0,0,0,0,0,0,,2,25,2
203041,C041,C041*,6811,農産店,Farm Store,,,木材2レンガ2,収穫の食料供給フェイズの後に、ちょうど食料1を異なる種類の資材2または野菜1と交換できる。,,0,0,,0,0,0,0,0,0,0,0,1,0,0,0,0,0,0,0,0,,2,25,2
203042,C042,C042*,6854,激しい空腹,Ravenous Hunger,,,小麦1,アクションスペース「野菜の種」を使用するたび、その直後、累積スペースに他の人物1人を配置してもよい。さらに、追加でそこに累積する種類の品物1を得る。,,0,0,,0,0,0,0,0,0,0,0,1,0,0,0,0,0,0,0,0,,2,25,2
203043,C043,C043,9382,農舎,Farm Building,,,レンガ1葦1,大きい進歩を建設するたびに、それ以降の3ラウンドのスペースに食料を1つずつ置く。これらのラウンドのはじめにその食料を得る。,,1,1,,0,0,0,0,0,0,0,0,0,1,0,0,0,0,0,0,0,,2,25,2
203044,C044,C044*,1396,鶏小屋,Chicken Coop,,,葦1＋木材2/レンガ2,この先の8ラウンドのスペースに食料1ずつ置く。これらのラウンドのはじめにその食料を得る。,,0,1,,0,0,0,0,0,0,0,0,0,1,0,0,0,0,0,0,0,,2,25,2
203045,C045,C045,9383,シチュー,Stew,,,レンガ1,「日雇い労働者」のアクションスペースを使いたびに、それ以降の4ラウンドのスペースに食料を1つずつ置く。これらのラウンドのはじめにその食料を得る。,,1,0,,0,0,0,0,0,0,0,0,0,1,0,0,0,0,0,0,0,,2,25,2
203046,C046,C046,9384,野菜スライサー,Mandoline,,,木材1,各ラウンドに1度、野菜1を払うことでボーナス1点を得ることができる。そうした場合、それ以降の2ラウンドのスペースに食料1ずつ置く。これらのラウンドのはじめにその食料を得る。,,0,0,,0,1,0,0,0,0,0,0,0,1,0,0,0,0,0,0,0,,2,25,2
203047,C047,C047,9385,庭熊手,Garden Claw,,,木材1,栽培中の畑の数の3倍まで、残りのラウンドスペースに食料を1つずつ置く。これらのラウンドのはじめにその食料を得る。,,0,0,,0,0,0,0,0,0,0,0,0,1,0,0,0,0,0,0,0,,2,25,2
203048,C048,C048,9386,農園,Farmstead,,職業1,,未使用の農場スペースを使った各手番の後に食料1を得る。,,1,0,,0,0,0,0,0,0,0,0,0,1,0,0,0,0,0,0,0,,2,25,2
203049,C049,C049,9387,ビール屋台,Beer Stall,,,木材1,各収穫の食料供給フェイズで、柵で囲まれていない空の厩1つにつき、小麦1を食料5に交換できる。,,1,0,,0,0,0,0,0,0,0,0,0,1,0,0,0,0,0,0,0,,2,25,2
203050,C050,C050,9388,厩の庭,Stable Yard,,厩3と牧場3,,このカードを出したとき、すぐにまだ始まっていないラウンド1につき食料1を得る。いつでも羊1と猪1の組み合わせを牛1と交換できる。,,0,1,,0,0,0,0,0,0,0,0,0,1,0,0,0,0,0,0,0,,2,25,2
203051,C051,C051*,7894,漁網,Fishing Net,,,葦1,他のプレイヤーは累積スペース「漁」を使用するたび、その前にあなたに食料1を支払わなければならない。そうした場合、そのラウンドの帰宅フェイズに「漁」に食料2を置く。,,0,1,,0,0,0,0,0,0,0,0,0,1,0,0,0,0,0,0,0,,2,25,2
203052,C052,C052,9389,猟師の帽子,Huntsman's Hat,,:鍋:の進歩,葦1,アクションスペースの効果により得た新しい猪ごとに食料1も得る。,,0,1,,0,0,0,0,0,0,0,0,0,1,0,0,0,0,0,0,0,,2,25,2
203053,C053,C053,9390,三つ足やかん,Gypsy's Crock,,,レンガ2,:鍋:進歩を使って品物2つを同時に食料に変えるたび、追加で食料1を得る。,,1,1,,0,0,0,0,0,0,0,0,0,1,0,0,0,0,0,0,0,,2,25,2
203054,C054,C054,9391,露店,Market Stall,,,あなたのストックから厩1,各収穫の畑フェイズの後、小麦1と柵1（両方とも自分のストックから）の組を食料5と交換できる。,,0,0,,0,0,0,0,0,0,0,0,0,1,0,0,0,0,0,0,0,,2,25,2
203055,C055,C055,9392,アトリエ,Studio,,,レンガ1葦1,各収穫の食料供給フェイズで、このカードを使ってちょうど木材1/レンガ1/石材1を食料2/2/3に変えることができる。,,1,1,,0,0,0,0,0,0,0,0,0,1,0,0,0,0,0,0,0,,2,25,2
203056,C056,C056*,7424,給餌柵,Feed Fence,,,木材1,新たに厩1を建設するたび、食料1を得る。それが最後の厩なら代わりに食料3を得る。厩を建設するたび、ちょうど厩1を木材の代わりにレンガ1で建設できる。,,0,0,,0,0,0,0,0,0,0,0,0,1,0,0,0,0,0,0,0,,2,25,2
203057,C057,C057,9393,生野菜,Crudité,,,,このカードを出したとき、すぐにちょうど野菜1を食料3で購入できる。いつでも畑にある2つ以上重なっている野菜の一番上の野菜を捨てることで、食料4を得ることができる。,,0,0,,0,0,0,0,0,0,0,0,0,1,0,0,0,0,0,0,0,,2,25,2
203058,C058,C058,9394,木彫り,Woodcraft,,職業1,,木材の累積スペースを使うたび、その後すぐに自分のストックの木材が5以下の場合、食料1を得る。,,1,0,,0,0,0,0,0,0,0,0,0,1,0,0,0,0,0,0,0,,2,25,2
203059,C059,C059*,7989,火酒製造所,Schnapps Distillery,,,石材2野菜1,食料供給フェイズ時、このカードで野菜ちょうど1を食料5に変換できる。得点計算時に、5つ目と6つ目の野菜それぞれについてボーナス1点を得る。,,0,2,,0,1,0,0,0,0,0,0,0,1,0,0,0,0,0,0,0,,2,25,2
203060,C060,C060,9395,陶工の小窯,Small Potter's Oven,,レンガ窯か石窯を返す,レンガ2,このカードを出したとき、すぐに食料5を得る。「パンを焼く」アクションを行うたび、その前に大きい進歩「レンガ窯」か「石窯」を建設することができる。,,0,5,,0,0,0,0,0,0,0,0,0,1,0,0,0,0,0,0,0,,2,25,2
203061,C061,C061,9396,ビアジョッキ,Beer Stein,,,レンガ1,「パンを焼く」アクションを行うたび、このカードを1回だけ使用して小麦1を、食料2とボーナス1点に変えることができる。,,0,0,,0,1,0,0,0,0,0,0,0,1,0,0,0,0,0,0,0,,2,25,2
203062,C062,C062,9397,調理場の拡張,Cooking Hearth Extension,,,レンガ2,収穫のたびに1度、それぞれの:鍋:進歩を使って家畜1か野菜1を調理するときに2倍の食料を得る。,,1,0,,0,0,0,0,0,0,0,0,0,1,0,0,0,0,0,0,0,,2,25,2
203063,C063,C063,9398,クラフトビール醸造所,Craft Brewery,,,木材2レンガ1,各収穫の食料供給フェイズで、このカードを使って自分のストックの小麦1と畑の小麦1をボーナス2点と食料4に交換できる。,,0,0,,0,0,0,0,0,0,0,0,0,1,0,0,0,0,0,0,0,,2,25,2
203064,C064,C064,9399,シュナップス蒸留所,Corn Schnapps Distillery,,,木材1レンガ2,各ラウンドに1度、小麦1を払ってそれ以降の4ラウンドのスペースに食料を1つずつ置くことができる。これらのラウンドのはじめにその食料を得る。,,1,0,,0,0,0,0,0,0,0,0,0,1,0,0,0,0,0,0,0,,2,25,2
203065,C065,C065*,1469,穀物倉庫,Granary,,,木材3/レンガ3,ラウンド8、10、12のうち開始前のラウンドスペースに小麦1ずつ置く。これらのラウンドのはじめに、その小麦を得る。,,0,1,,0,0,0,0,0,0,0,0,0,0,1,0,0,0,0,0,0,,2,25,2
203066,C066,C066,9400,永久ライ麦栽培,Eternal Rye Cultivation,,小麦畑1,,各収穫の後に自分のストックに小麦2がある場合、食料1を得る。3以上ある場合は代わりに小麦1を得る。,,0,0,,0,0,0,0,0,0,0,0,0,0,1,0,0,0,0,0,0,,2,25,2
203067,C067,C067,9401,ミネラルフィーダー,Mineral Feeder,,,葦1,収穫のない各ラウンドの開始時、牧場に羊を1頭以上飼っている場合、小麦1を得る。,,1,1,,0,0,0,0,0,0,0,0,0,0,1,0,0,0,0,0,0,,2,25,2
203068,C068,C068*,1214,書棚,Bookcase,,職業1,木材2,職業1を出すたび、その後に野菜1を得る。,,0,0,,0,0,0,0,0,0,0,0,0,0,1,0,0,0,0,0,0,,2,25,2
203069,C069,C069,9402,区画整理,Land Consolidation,,,,いつでも、1つの畑にある小麦3を野菜1に置き換えることができる（元の場所に置く）。,,1,0,,0,0,0,0,0,0,0,0,0,0,1,0,0,0,0,0,0,,2,25,2
203070,C070,C070*,1416,レタス畑,Lettuce Patch,,職業3,,このカードは畑1であり、野菜だけを植えられる。このカードから収穫した野菜を、すぐに食料4に変換してもよい。,,0,1,,0,0,0,0,0,0,0,0,0,0,1,0,0,0,0,0,0,,2,25,2
203071,C071,C071,9403,液体肥料,Slurry,,,,各収穫の繁殖フェイズに、2種類以上の家畜を繁殖させた場合、「種をまく」アクションを得る。,,0,0,,0,0,0,0,0,0,0,0,0,0,1,0,0,0,0,0,0,,2,25,2
203072,C072,C072,9404,収穫祭計画,Harvest Festival Planning,,職業2,食料1,このカードを出したとき、すぐに収穫の畑フェイズを行う。その後、「大きいまたは小さい進歩」アクションを得る。,,1,0,,0,0,0,0,0,0,0,0,0,0,1,0,0,0,0,0,0,,2,25,2
203073,C073,C073,9405,海藻肥料,Seaweed Fertilizer,,,食料2,制約のない「種をまく」アクションを行うたび、その後に共通のストックから小麦1を得る。ラウンド11以降は代わりに代わりに野菜1を得ることができる。,,0,0,,0,0,0,0,0,0,0,0,0,0,1,0,0,0,0,0,0,,2,25,2
203074,C074,C074*,7974,個人の森,Private Forest,,職業1,食料2,未プレイの偶数ラウンドのスペース全てに木材1ずつ置く。これらのラウンドのはじめにその木材を得る。,,0,0,,0,0,0,0,0,0,0,0,0,0,0,1,0,0,0,0,0,,2,25,2
203075,C075,C075,9406,薪,Firewood,,,食料2,各ラウンドの帰宅フェイズで、このカードに木材1を置く。かまど、調理場または窯を建設するたび、その前にこのカードから自分のストックへ木材を最大4まで移す。,,0,0,,0,0,0,0,0,0,0,0,0,0,0,1,0,0,0,0,0,,2,25,2
203076,C076,C076,1360,木材荷車,Wood Cart,,職業3,木材3,木材の累積スペースを使うたび、追加で木材2を得る。,,0,0,,0,0,0,0,0,0,0,0,0,0,0,1,0,0,0,0,0,,2,25,2
203077,C077,C077,7652,レンガ補給,Clay Supply,,,食料1,これ以降の3ラウンドのスペースにレンガを1つずつ置く。これらのラウンドのはじめにそのレンガを得る。,,1,0,,0,0,0,0,0,0,0,0,0,0,0,1,0,0,0,0,0,,2,25,2
203078,C078,C078,6856,葦帽子のヒキガエル,Reed-Hatted Toad,,,食料1,現在のラウンド数に5、7、9、11、13を足し、対応するラウンドスペースに葦1を置く。これらのラウンドのはじめにその葦を得る。,,1,0,,0,0,0,0,0,0,0,0,0,0,0,1,0,0,0,0,0,,2,25,2
203079,C079,C079*,1360,石車,Wood Cart,,職業2,木材2,未プレイの偶数ラウンドのスペース全てに石材1ずつ置く。これらのラウンドのはじめにその石材を得る。,,0,0,,0,0,0,0,0,0,0,0,0,0,0,1,0,0,0,0,0,,2,25,2
203080,C080,C080,9407,岩の多い地形,Rocky Terrain,,,食料1,畑（タイルまたはカード）を耕すたび、食料1で石材1を購入できる。,,1,0,,0,0,0,0,0,0,0,0,0,0,0,1,0,0,0,0,0,,2,25,2
203081,C081,C081,9408,資源拠点,Material Hub,,ストックに葦1と石材1,木材1レンガ1,すぐにこのカードに資材コマを2個ずつ置く。いずれかのプレイヤー（あなたを含む）が5個以上の木材か4個以上のレンガが3個以上の葦か3個以上の石材を取るたび、あなたはそれと同じ種類の資材コマ1をこのカードから得る。,,1,0,,0,0,0,0,0,0,0,0,0,0,0,1,0,0,0,0,0,,2,25,2
203082,C082,C082,9409,金物屋,Hardware Store,,,木材1レンガ1,「日雇い労働者」のアクションスペースを使うたび、その後食料2を払うことで、木材1とレンガ1と葦1と石材1を購入できる。,,1,1,,0,0,0,0,0,0,0,0,0,0,0,1,0,0,0,0,0,,2,25,2
203083,C083,C083,9410,若牛,Early Cattle,,,,このカードを出したとき、すぐに牛2を得る。,,0,-3,,0,0,0,0,0,0,0,0,0,0,0,0,1,0,0,0,0,,2,25,2
203084,C084,C084,9411,ライ麦飼料,Perennial Rye,,職業2,食料1,収穫のない各ラウンドの終わりに、小麦1を払うことで家畜ちょうど1種類を繁殖できる。（これは繁殖フェイズとは見なさない）,,1,0,,0,0,0,0,0,0,0,0,0,0,0,0,1,0,0,0,0,,2,25,2
203085,C085,C085,9297,ねぐら作り,Den Builder,1,,,レンガまたは石の家に住んでいるとき、小麦1と食料2を払うことができる。そうした場合、このカードは人物がちょうど1人住める場所となる。,,0,0,,0,0,0,0,0,1,0,0,0,0,0,0,0,0,0,0,0,,1,25,2
203086,C086,C086*,7506,家畜の餌係,Livestock Feeder,1,,,このカードを出したとき、すぐに小麦1を得る。あなたのストックの小麦1につき、好きな種類の家畜1を収容できる。（これらの家畜は農場に収容しているとみなす。）,,0,0,,0,0,0,0,0,1,0,0,0,0,0,0,0,0,0,0,0,,1,25,2
203087,C087,C087*,1449,左官屋,Mason,1,,,このカードの上に石の部屋1を置く。石の家4部屋以上になり次第、いつでも資材を支払うことなくその部屋を建築できる。,,0,0,,0,0,0,0,0,1,0,0,0,0,0,0,0,0,0,0,0,,1,25,2
203088,C088,C088,9298,見習い大工,Carpenter's Apprentice,1,,,木の部屋のコストが木材2安くなる。3つ目と4つ目の厩のコストが木材1安くなる。あなたの13番目から15番目までの柵のコストは無料になる。,,1,0,,0,0,0,0,0,1,0,0,0,0,0,0,0,0,0,0,0,,1,25,2
203089,C089,C089,7763,厩作り,Stable Master,1,,,このカードを出したとき、すぐに木材1で厩ちょうど1つを建設できる。あなたの柵で囲まれていない厩ちょうど1つは1種類の家畜3頭まで飼育できる。,,1,0,,0,0,0,0,0,1,0,0,0,0,0,0,0,0,0,0,0,,1,25,2
203090,C090,C090*,1363,畑番,Field Watchman,1,,,アクションスペース「小麦の種」を使用するたび、追加で畑1を耕してもよい。,,0,0,,0,0,0,0,0,1,0,0,0,0,0,0,0,0,0,0,0,,1,25,2
203091,C091,C091,9299,耕作の英雄,Plow Hero,1,,,ラウンドの1人目の人物で「農地」または「耕作」のアクションスペースを使うたび、食料1を払うことで畑1を追加で耕すことができる。（アクションスペース「畑」は名称が「農地」に変更されました）,,1,0,,0,0,0,0,0,1,0,0,0,0,0,0,0,0,0,0,0,,1,25,2
203092,C092,C092,9300,秋の母,Autumn Mother,1,,,収穫の前、家の部屋が空いている場合、すぐに食料3を払うことで、「家族を増やす」アクションを行うことができる。,,1,0,,0,0,0,0,0,0,1,0,0,0,0,0,0,0,0,0,0,,1,25,2
203093,C093,C093,9301,内地管理者,Inner Districts Director,1,,,累積スペース「森林」または「粘土坑」を使うたび、共通のストックから石材1をもう片方のスペースに置くことができる。そうした場合、すぐに他の人物を置くことができる。,,0,0,,0,0,0,0,0,0,1,0,0,0,0,0,0,0,0,0,0,,1,25,2
203094,C094,C094,9302,厩掃除人,Stable Cleaner,1,,,いつでも、人物を置かずに「厩の建設」アクションを行うことができる。そうする場合の各厩の建設コストは木材1と食料1になる。,,1,0,,0,0,0,0,0,0,1,0,0,0,0,0,0,0,0,0,0,,1,25,2
203095,C095,C095,9303,カゴ編み,Basket Weaver,1,,,このカードを出したとき、すぐに大きい進歩「カゴ製作所」を石材1と葦1を払って建設する。,,0,0,,0,0,0,0,0,0,1,0,0,0,0,0,0,0,0,0,0,,1,25,2
203096,C096,C096,1546,販売人,Merchant,1,,,「大きいまたは小さい進歩1」か「小さい進歩1」アクションを行った後、すぐに食料1を払って2度目の同じアクションを行うことができる。,,0,0,,0,0,0,0,0,0,1,0,0,0,0,0,0,0,0,0,0,,1,25,2
203097,C097,C097,9304,種子研究者,Seed Researcher,1,,,アクションスペース「小麦の種」と「野菜の種」の両方からいずれかの人物が戻るたび食料2を得る。さらに、コストなしで職業1を出すことができる。,,0,0,,0,0,0,0,0,0,1,0,0,0,0,0,0,0,0,0,0,,1,25,2
203098,C098,C098,7606,サイコロ彫り,Cube Cutter,1,,,このカードを出したとき、すぐに木材1を得る。各収穫の畑フェイズで、このカードを使ってちょうど木材1と食料1をボーナス1点に交換できる。,,0,0,,0,1,0,0,0,0,0,1,0,0,0,0,0,0,0,0,0,,1,25,2
203099,C099,C099,9305,庭園デザイナー,Garden Designer,1,,,得点計算の開始時に、空いている畑に好きな数の食料を置くことができる。食料1/4/7がある畑1つにつきボーナス1/2/3点を得る。,,1,0,,0,1,0,0,0,0,0,1,0,0,0,0,0,0,0,0,0,,1,25,2
203100,C100,C100,9306,使用人頭,Butler,1,,,ラウンド11以前にこのカードを出していて、得点計算時に人物より部屋の数が多い場合、ボーナス4点を得る。,,0,0,,0,1,0,0,0,0,0,1,0,0,0,0,0,0,0,0,0,,1,25,2
203101,C101,C101,9307,屋台の所有者,Stall Holder,1,,,各ラウンドに1度、農場に柵で囲まれていない厩が0/1/2/3/4ある場合、小麦2をボーナス1点と食料1/2/3/4/5に交換できる。,,0,0,,0,1,0,0,0,0,0,1,0,0,0,0,0,0,0,0,0,,1,25,2
203102,C102,C102,9308,森林保護者,Tree Guard,1,,,木材の累積スペースを使うたび、その後で自分のストックからそのスペースに木材4を置くことで、石材2とレンガ1と葦1と小麦1を得ることができる。,,1,0,,0,0,0,0,0,0,0,0,1,0,0,0,0,0,0,0,0,,1,25,2
203103,C103,C103,9309,青果商,Green Grocer,1,,,"各ラウンドの開始時、以下のうち1種類の交換を1度だけできる：
牛1→野菜1　野菜1→牛1
羊2→野菜1　野菜1→羊2
食料2→小麦1　小麦1→食料2",,1,0,,0,0,0,0,0,0,0,0,1,0,0,0,0,0,0,0,0,,1,25,2
203104,C104,C104*,2548,収集家,Collector,1,,,このカードはあなた専用のアクションスペースである、1/2/3/4回目に使用するとき、物乞い1と別種の品物6/7/8/9を得る。,,0,0,,0,0,0,0,0,0,0,0,1,0,0,0,0,0,0,0,0,,1,25,2
203105,C105,C105,9310,カゴ運び,Basket Carrier,1,,,各収穫で1度、食料2を払って木材1と葦1と小麦1を購入できる。,,1,0,,0,0,0,0,0,0,0,0,1,0,0,0,0,0,0,0,0,,1,25,2
203106,C106,C106*,1253,じゃがいも収穫者,Potato Harvester,1,,,このカードを出したとき、すぐに食料3を得る。収穫の畑フェイズで畑から得た野菜の数だけ、追加で食料1を得る。,,0,0,,0,0,0,0,0,0,0,0,0,1,0,0,0,0,0,0,0,,1,25,2
203107,C107,C107*,1442,パン職人,Baker,1,,,このカードを出したとき、及び、食料供給フェイズのはじめに、「パンを焼く」アクションを行ってもよい。,,0,0,,0,0,0,0,0,0,0,0,0,1,0,0,0,0,0,0,0,,1,25,2
203108,C108,C108*,1550,居候,Layabout,1,,,このカードを出したとき、次の収穫をスキップする。（その収穫で家族に食料供給をしなくてよい。）,,0,0,,0,0,0,0,0,0,0,0,0,1,0,0,0,0,0,0,0,,1,25,2
203109,C109,C109*,1458,火酒作り,Schnapps Distiller,1,,,収穫の畑フェイズ時、このカードで野菜ちょうど1を食料5に変換できる。,,0,0,,0,0,0,0,0,0,0,0,0,1,0,0,0,0,0,0,0,,1,25,2
203110,C110,C110*,7582,自家醸造師,Home Brewer,1,,,収穫の畑フェイズの後に、小麦ちょうど1を食料3かボーナス1点に変換してもよい。,,0,0,,0,1,0,0,0,0,0,0,0,1,0,0,0,0,0,0,0,,1,25,2
203111,C111,C111,9311,小動物ブリーダー,Small Animal Breeder,1,,,各ラウンドの開始時、現在のラウンド数以上の食料（たとえばラウンド8であれば8以上）を持っている場合、食料1を得る。,,0,0,,0,0,0,0,0,0,0,0,0,1,0,0,0,0,0,0,0,,1,25,2
203112,C112,C112*,1246,脱穀者,Thresher,1,,,アクションスペース「穀物活用」、「農地」または「耕作」を使用するたび、その直前に食料1を支払って小麦1を購入できる。,,0,0,,0,0,0,0,0,0,0,0,0,0,1,0,0,0,0,0,0,,1,25,2
203113,C113,C113*,1252,冬場の管理人,Winter Caretaker,1,,,このカードを出したとき、すぐに小麦1を得る。収穫の終わりに、食料ちょうど2を支払って野菜1を購入できる。,,0,0,,0,0,0,0,0,0,0,0,0,0,1,0,0,0,0,0,0,,1,25,2
203114,C114,C114,9312,土壌科学者,Soil Scientist,1,,,レンガ/石材の累積スペースを使うたび、その後そのスペースに自分のストックから石材1/レンガ2をそのスペースに置くことで、小麦2/野菜1をそれぞれ得ることができる。,,1,0,,0,0,0,0,0,0,0,0,0,0,1,0,0,0,0,0,0,,1,25,2
203115,C115,C115,9313,種まき人,Sower,1,,,大きい進歩を建設するたび、このカードの上に共通ストックから葦1を置く。いつでもその葦を自分のストックに移動できる、またはその葦を「種をまく」アクションと交換できる。,,1,0,,0,0,0,0,0,0,0,0,0,0,1,0,0,0,0,0,0,,1,25,2
